{
  "schema_version":"book-radar-evidence-cards/v1",
  "run_id":"RN9",
  "observed_at":"2026-09-08",
  "cards":[
    {
      "id":"RN9-001","source_family":"EXISTING_BOOK_BUYERS","buyer":"New or recently upgraded US RV owner","purchase_reason":"Keep maintenance, warranty, recall, and resale records together","specific_task":"Turn manuals, service visits, receipts, and recall checks into a usable evidence trail","comparable_book_purchase_evidence":{"status":"SUPPORTED","source_ids":["RN9-S01","RN9-S02"]},"unmet_scenario":"Low-content logs are too blank, too small, or provide too little guidance for warranty and resale documentation","accessible_gap":{"status":"SUPPORTED","source_ids":["RN9-S01","RN9-S03"]},"book_format":"PAPERBACK_WORKBOOK","format_reason":"A durable write-in record can stay with vehicle documents and be used during service","discovery_query_or_channel":"RV maintenance log book; RV maintenance record book","observations":[{"source_id":"RN9-S01","independence_key":"amazon-review-cluster-rv-essentials","observed_at":"2026-04-30","observation":"Recent buyers describe purchasing a physical log for a new RV, warranty records, and future resale; one says it is mostly blank and lacks enough pages or tips","interpretation":"The write-in book job is real and guidance depth is a concrete gap","alternative_explanation":"Reviews are syndicated by a reseller and may overrepresent one title"},{"source_id":"RN9-S02","independence_key":"gorving-buyer-request","observed_at":"2021-09-08","observation":"An RV owner explicitly asks which current maintenance book to buy and another reports buying a manual after comparing reviews and videos","interpretation":"RV owners deliberately buy printed maintenance references","alternative_explanation":"The request is for repair instruction, not a record system"},{"source_id":"RN9-S03","independence_key":"rv-digital-alternatives","observed_at":"2026-09-08","observation":"Free templates and dedicated apps cover logging, reminders, components, and service history","interpretation":"A paid book must add extraction, evidence, and handoff workflow rather than blank forms","alternative_explanation":"Digital tools may eliminate the need for a book"}],"source_independence":{"minimum_independent_sources":2,"rationale":"Distinct buyer-review cluster, community request, and current digital alternatives"},"freshness":{"as_of":"2026-09-08","window_closes":null,"preparation_days":60},"production_constraints":["No generic maintenance intervals","Use owner manuals and service professionals as controlling sources","No repair or safety instruction","No receipt pocket promise"],"main_uncertainty":"Whether the guided system can earn a premium over $6.99 low-content logs","rights_status":"CLEAR","expertise_status":"SOURCE_DEPENDENT_OK","early_decision":"DEEP_SCAN_ELIGIBLE","concept":"RV Maintenance Evidence Book"},
    {
      "id":"RN9-002","source_family":"DIRECT_BOOK_REQUESTS","buyer":"Advanced-beginner garment sewer fitting clothes on their own body","purchase_reason":"Diagnose fit problems without an in-person fitter","specific_task":"Read wrinkles and balance lines, choose an adjustment order, and record successive muslins","comparable_book_purchase_evidence":{"status":"SUPPORTED","source_ids":["RN9-S04","RN9-S05"]},"unmet_scenario":"Authoritative fitting books can feel overwhelming and often assume a second person is fitting the garment","accessible_gap":{"status":"SUPPORTED","source_ids":["RN9-S04","RN9-S06"]},"book_format":"COLOR_PAPERBACK_WORKBOOK","format_reason":"Readers explicitly prefer a physical reference beside the sewing table; visual diagnosis and iteration notes benefit from print","discovery_query_or_channel":"beginner garment fitting book; self fitting sewing book","observations":[{"source_id":"RN9-S04","independence_key":"sewing-request-2026-july","observed_at":"2026-07-24","observation":"A buyer says one fitting book was overwhelming, puts alternatives on library hold, and states this information clicks better in a physical book","interpretation":"Physical-book preference and the overwhelm gap are directly stated","alternative_explanation":"Library borrowing may be preferred over buying"},{"source_id":"RN9-S05","independence_key":"goodreads-veblen-readers","observed_at":"2026-03-03","observation":"Readers describe buying or keeping the 224-page photo guide as a reference; several note beginner value","interpretation":"The reference-book job has durable purchase evidence","alternative_explanation":"The incumbent may already satisfy the need"},{"source_id":"RN9-S06","independence_key":"independent-review-self-fit","observed_at":"2024-03-25","observation":"Independent reviews say the book targets serious sewists and its method fits a garment on another person","interpretation":"A bounded self-fitting workflow may be an accessible scenario gap","alternative_explanation":"The technical method may inherently require a helper"}],"source_independence":{"minimum_independent_sources":2,"rationale":"Current buyer request, reader reviews, and independent specialist review"},"freshness":{"as_of":"2026-09-08","window_closes":null,"preparation_days":120},"production_constraints":["Original or licensed diagrams","Independent technical review","Color printing economics","Do not reproduce competitor diagnostic sequences"],"main_uncertainty":"Whether a safe self-fitting simplification is technically valid without expert authorship","rights_status":"CLEAR","expertise_status":"SOURCE_DEPENDENT_OK","early_decision":"DEEP_SCAN_ELIGIBLE","concept":"Self-Fitting Triage Workbook for Sewists"},
    {
      "id":"RN9-003","source_family":"SPECIALIZED_STABLE_MARKETS","buyer":"UK resident newly assigned an allotment","purchase_reason":"Avoid being overwhelmed during the first growing year","specific_task":"Turn an empty or neglected plot into a manageable first-season plan","comparable_book_purchase_evidence":{"status":"SUPPORTED","source_ids":["RN9-S07","RN9-S08"]},"unmet_scenario":"Comprehensive 224-352 page guides are useful but can be busy; beginners ask for a simple hold-my-hand sequence","accessible_gap":{"status":"SUPPORTED","source_ids":["RN9-S08","RN9-S09"]},"book_format":"PAPERBACK_FIELD_PLANNER","format_reason":"Buyers keep month-by-month books at hand and use charts or plans at the plot","discovery_query_or_channel":"first allotment book UK; allotment month by month","observations":[{"source_id":"RN9-S07","independence_key":"rhs-publisher-catalog","observed_at":"2026-09-08","observation":"RHS maintains a £14.99 paperback handbook/planner in its specialist catalogue","interpretation":"A credible specialist publisher sustains the format","alternative_explanation":"Catalogue presence alone does not prove current sales"},{"source_id":"RN9-S08","independence_key":"allotment-buyers-2026","observed_at":"2026-05-03","observation":"A new allotment holder is told the month-by-month book is needed at hand rather than repeatedly borrowed","interpretation":"The physical reference job is explicit","alternative_explanation":"One recommendation may reflect incumbent brand familiarity"},{"source_id":"RN9-S09","independence_key":"allotment-planning-request-2025","observed_at":"2025-10-01","observation":"A first-plot buyer asks for planning help and describes an existing planting guide as overwhelming and busy","interpretation":"Simplicity is a specific gap","alternative_explanation":"Established alternatives may already offer simpler formats"}],"source_independence":{"minimum_independent_sources":2,"rationale":"Specialist publisher plus two separate buyer discussions"},"freshness":{"as_of":"2026-09-08","window_closes":null,"preparation_days":90},"production_constraints":["UK climate and regional variance","Horticultural fact-checking","Avoid prescriptive dates without conditions"],"main_uncertainty":"Whether simplicity is enough to beat trusted RHS and bestselling incumbents","rights_status":"CLEAR","expertise_status":"SOURCE_DEPENDENT_OK","early_decision":"DEEP_SCAN_ELIGIBLE","concept":"Your First Allotment Year: A Low-Overwhelm UK Field Planner"},
    {